Name,NameAlphabetized,Name - NYC.gov Agency List,Name - NYC.gov Mayor's Office,Name - NYC Open Data Portal,Name - ODA,Name - CPO,Name - WeGov,Name - Greenbook,Name - Checkbook,Name - HOO,Name - Ops,NameWithAcronym,NameAlphabetizedWithAcronym,Agency Name,AgencyNameEnriched,LegalName,AlternateNames,OperationalStatus,PreliminaryOrganizationType,Description,URL,ParentOrganization,NYCReportingLine,AuthorizingAuthority,LegalCitation,LegalCitationURL,LegalCitationText,Acronym,AlternateAcronyms,BudgetCode,PrincipalOfficerName,PrincipalOfficerTitle,OpenDatasetsURL,Notes,FoundingYear,SunsetYear,URISlug,DateCreated,DateModified,LastVerifiedDate,PrincipalOfficerGivenName,PrincipalOfficerFamilyName,source,HeadOfOrganizationTitle,RecordID,HeadOfOrganizationName,NameNormalized,Entity type,data_source,merged_from,merge_note,dedup_source
Municipal Reference and Research Center,"Reference and Research Center, Municipal",,,,,,,,,,,Municipal Reference and Research Center,"Reference and Research Center, Municipal",Municipal Reference and Research Center,,,,Active,Division,,,Department of Records and Information Systems,Department of Records and Information Systems,New York City Charter,"Chapter 72, Section 3004.2",https://codelibrary.amlegal.com/codes/newyorkcity/latest/NYCcharter/0-0-0-6582,"The department shall operate a municipal reference and research center, the head of which shall be a professional librarian.",,,,,,,,1969.0,,municipal-reference-and-research-center,2024-07-29,,,,,primary,,REC_000159,,municipal reference and research center,,nyc_agencies_export,,,primary
New York City Courts,"Courts, New York City",,,,,,,New York City Courts,,,,New York City Courts,"Courts, New York City",New York City Courts,,,,Active,Judiciary,,https://www.nycourts.gov/,,,New York State,,,,,,,,,,,1962.0,,new-york-city-courts,2024-07-29,,,,,primary,,REC_000160,,courts,,nyc_agencies_export,,,primary
New York Research Libraries,New York Research Libraries,,,,,,,,New York Research Libraries,,,New York Research Libraries,New York Research Libraries,New York Research Libraries,,,,Active,Non-Governmental Organization,,,,,New York State Law,,,,,,,,,,,1895.0,,new-york-research-libraries,2024-07-29,,,,,primary,,REC_000168,,new york research libraries,,nyc_agencies_export,,,primary
Cyber Command,Cyber Command,,,,NYC Cyber Command (NYC3),,NYC Cyber Command,,,,,Cyber Command (NYC3),Cyber Command (NYC3),Cyber Command,,,,Active,Division,,https://www.nyc.gov/content/oti/pages/meet-the-team/cyber-command,Office of Technology and Innovation,Office of Technology and Innovation,New York City Charter,"Chapter 1, Section 20-j",https://codelibrary.amlegal.com/codes/newyorkcity/latest/NYCcharter/0-0-0-5726,The mayor shall establish an office of cyber command. Such office may be established in the executive office of the mayor or as a separate office or within any department the head of which is appointed by the mayor. Such office shall be headed by a director who shall be appointed by the mayor or the head of such department and who shall serve as the chief information security officer of the city.,NYC3,,,,,,"NYC Cyber Command was integrated into the Office of Technology and Innovation (OTI) in November 2021 through Executive Order No. 3. This integration was part of a broader initiative to streamline and enhance the city's technology and innovation efforts by merging several technology-focused entities, including the NYC Office of Data Analytics (ODA), the Mayor's Office of the Chief Technology Officer (MOCTO), the Mayor's Office of Information Privacy (MOIP), and NYC 311. While the Department of Information Technology and Telecommunications (DoITT) continues to exist solely for legal contract purposes, its operational functions, including those of NYC Cyber Command, have been incorporated into OTI. This consolidation aims to create a unified approach to technology deployment and innovation, improving service efficiency and coordination across NYC government agencies.",2017.0,,cyber-command,2024-07-29,,,,,primary,,REC_000172,,cyber command,,nyc_agencies_export,,,primary
NYC Nonprofits,NYC Nonprofits,,,,Mayor's Office of Nonprofits (NYC NONPROFITS),Mayor's Office of Nonprofits,,,,,,NYC Nonprofits (NYC NONPROFITS),NYC Nonprofits (NYC NONPROFITS),NYC Nonprofits,,Office of not-for-profit organization services,Office of not-for-profit organization services; Mayor's Office of Nonprofits,Active,Mayoral Office,,https://www.nyc.gov/site/nonprofits/about/about.page,Mayor's Office,Deputy Mayor for Strategic Initiatives,New York City Charter,"Chapter 1, Section 20-o",https://codelibrary.amlegal.com/codes/newyorkcity/latest/NYCcharter/0-0-0-5857,"The mayor shall establish an office of not-for-profit organization services. Such office may be established in the executive office of the mayor and may be established as a separate office or within any other office of the mayor or within any department the head of which is appointed by the mayor. Such office shall be headed by an executive director who shall be appointed by the mayor or the head of such department. Subject to appropriation, such office shall also include such other employees as may be appointed or designated to assist in the performance of the duties of the office.",NYC NONPROFITS,,2.0,,,,,,,nyc-nonprofits,2024-07-29,,,,,primary,,REC_000178,,nonprofits,,nyc_agencies_export,,,primary
Office for Neighborhood Safety and the Prevention of Gun Violence,"Neighborhood Safety and the Prevention of Gun Violence, Office for",,,,,,,,,,,Office for Neighborhood Safety and the Prevention of Gun Violence,"Neighborhood Safety and the Prevention of Gun Violence, Office for",Office for Neighborhood Safety and the Prevention of Gun Violence,,,,Reorganized,Mayoral Office,,,,,New York City Charter,"Chapter 1, Section 13-f",https://codelibrary.amlegal.com/codes/newyorkcity/latest/NYCcharter/0-0-0-5804,"The mayor shall establish an office for neighborhood safety and the prevention of gun violence. Such office may, but need not, be established in the executive office of the mayor and may be established as a separate office within any other office of the mayor. Such office shall be headed by a director who shall be appointed by the mayor. For the purposes of this section, the term ""director"" means the director of the office for neighborhood safety and the prevention of gun violence.",,,,,,,,,,office-for-neighborhood-safety-and-the-prevention-of-gun-violence,2024-07-29,,,,,primary,,REC_000182,,office for neighborhood safety and the prevention of gun violence,,nyc_agencies_export,,,primary
Office of Building Energy and Emissions Performance,"Building Energy and Emissions Performance, Office of",,,,,,,,,,,Office of Building Energy and Emissions Performance,"Building Energy and Emissions Performance, Office of",Office of Building Energy and Emissions Performance,,,,Active,Division,,,Department of Buildings,Department of Buildings,New York City Charter,"Chapter 26, Section 651",https://codelibrary.amlegal.com/codes/newyorkcity/latest/NYCcharter/0-0-0-5273,"There shall be in the department an office of building energy and emissions performance. The office shall be headed by a director, who is a registered design professional, who shall be appointed by and shall report to the commissioner.",,,,,,,,2019.0,,office-of-building-energy-and-emissions-performance,2024-07-29,,,,,primary,,REC_000187,,building office energy and emissions performance,,nyc_agencies_export,,,primary
Office of Climate Resiliency,"Climate Resiliency, Office of",,,,Office of Climate Resiliency (MOCR),,,,,,,Office of Climate Resiliency (MOCR),"Climate Resiliency, Office of (MOCR)",Office of Climate Resiliency,,,,Reorganized,Mayoral Office,,,,,Mayoral Executive Order,"Executive Order 4, 2022",https://a860-gpp.nyc.gov/concern/nyc_government_publications/st74cs877?locale=en,"The Office of Long-Term Planning and Sustainability shall be established within the Office of the Mayor and hereafter be designated as the Office of Climate and Environmental Justice, except in court documents, contracts and any other situation where the name “Office of Long-Term Planning and Sustainability” is legally required. Such office shall perform the functions delineated in section 20 of the Charter as well as those functions that have been performed by the former Office of Climate and Sustainability and the Office of Climate Resiliency.",MOCR,,,,,,,,,office-of-climate-resiliency,2024-07-29,,,,,primary,,REC_000189,,climate office resiliency,,nyc_agencies_export,,,primary
Office of Community Hiring,"Community Hiring, Office of","Community Hiring, Office of","Community Hiring, Office of",,,,,,,,,Office of Community Hiring,"Community Hiring, Office of",Office of Community Hiring,,,,Active,Mayoral Office,The Office of Community Hiring (OCH)'s mission is to use the City's purchasing power to drive economic mobility by connecting City vendors with a pipeline of talent and creating pathways to careers for our community.,https://www.nyc.gov/site/communityhiring/index.page,Mayor's Office of Talent and Workforce Development,Mayor's Office of Talent and Workforce Development,,"Chapter 79, Section 3502",https://codelibrary.amlegal.com/codes/newyorkcity/latest/NYCcharter/0-0-0-7050,"The mayor shall establish an office of community hiring and workforce development. Such office may be established as a separate office or within any department the head of which is appointed by the mayor. The office of community hiring and workforce development shall be headed by a director who shall be appointed by the mayor or head of such department. The director shall, as the director deems appropriate, adopt rules consistent with the purpose of this chapter relating to employment goals on transactions, including rules:",,,,Douglas Lipari,Executive Director,,,2023.0,,office-of-community-hiring,2024-07-29,,,Douglas,Lipari,primary,,REC_000191,,community office hiring,,nyc_agencies_export,"[{'id': 'HOO_000037', 'name': nan, 'score': None}]","Merged with HOO_000037
Conflicts: Agency Name: preferred='Office of Community Hiring', secondary='Community Hiring, Office of|Ethnic and Community Media, Mayor's Office of (MOECM)'; source: preferred='primary', secondary='nyc_gov'; RecordID: preferred='REC_000191', secondary='HOO_000037'; NameNormalized: preferred='community office hiring', secondary='community hiring office of executive director|ethnic and community media mayors office of executive director'; data_source: preferred='nyc_agencies_export', secondary='nyc_gov'",primary
Office of Crime Victim Services,"Crime Victim Services, Office of",,,,,,,,,,,Office of Crime Victim Services,"Crime Victim Services, Office of",Office of Crime Victim Services,,,,Active,Division,,https://criminaljustice.cityofnewyork.us/programs/ocvs/,Mayor's Office of Criminal Justice,Mayor's Office of Criminal Justice,New York City Charter,"Chapter 1, Section 13-d",https://codelibrary.amlegal.com/codes/newyorkcity/latest/NYCcharter/0-0-0-108,"The mayor shall establish an office of crime victim services. Such office may, but need not, be established in the executive office of the mayor, or may be established as a separate office within any other office of the mayor, or within any department, the head of which is appointed by the mayor. Such office shall be headed by a coordinator who shall be appointed by the mayor or the head of such department.",,,,,,,,2017.0,,office-of-crime-victim-services,2024-07-29,,,,,primary,,REC_000192,,crime office victim services,,nyc_agencies_export,,,primary
Office of Data Analytics,"Data Analytics, Office of",,,,Office of Data Analytics (ODA),,Office of Data Analytics,,,,,Office of Data Analytics (ODA),"Data Analytics, Office of (ODA)",Office of Data Analytics,,,Mayor's Office of Data Analytics,Active,Division,,https://www.nyc.gov/content/oti/pages/data-analytics,Office of Technology and Innovation,Office of Technology and Innovation,New York City Charter,"Chapter 1, Section 20-f",https://codelibrary.amlegal.com/codes/newyorkcity/latest/NYCcharter/0-0-0-5025,"The mayor shall establish an office of data analytics. Such office may be established in the executive office of the mayor and may be established as a separate office or within any other office of the mayor or within any department the head of which is appointed by the mayor. Such office shall be headed by a director who shall be appointed by the mayor or head of such department and who shall serve as the city's chief analytics officer and chief open platform officer, as defined in the open data policy and technical standards manual.",ODA,MODA,,,,,"The NYC Office of Data Analytics (ODA) was integrated into the Office of Technology and Innovation (OTI) in November 2021 through Executive Order No. 3. This integration was part of a broader initiative to streamline and enhance the city's technology and innovation efforts by merging several technology-focused entities, including NYC Cyber Command, the Mayor's Office of the Chief Technology Officer (MOCTO), the Mayor's Office of Information Privacy (MOIP), and NYC 311. While the Department of Information Technology and Telecommunications (DoITT) continues to exist solely for legal contract purposes, its operational functions, including those of the ODA, have been incorporated into OTI. This consolidation aims to create a unified approach to technology deployment and innovation, improving service efficiency and coordination across NYC government agencies.",2013.0,,office-of-data-analytics,2024-07-29,,,,,primary,,REC_000193,,data office analytics,,nyc_agencies_export,,,primary
Office of Diversity and Inclusion,"Diversity and Inclusion, Office of",,,,,,,,,,,Office of Diversity and Inclusion,"Diversity and Inclusion, Office of",Office of Diversity and Inclusion,,,,Active,Division,,,Department of Citywide Administrative Services,Department of Citywide Administrative Services,New York City Charter,"Chapter 35, Section 814.1",https://codelibrary.amlegal.com/codes/newyorkcity/latest/NYCcharter/0-0-0-6728,The commissioner shall establish an office of diversity and inclusion. Such office shall be headed by a chief who shall be appointed by the commissioner.,,,,,,,,2020.0,,office-of-diversity-and-inclusion,2024-07-29,,,,,primary,,REC_000194,,diversity office and inclusion,,nyc_agencies_export,,,primary
Office of Healthcare Accountability,"Healthcare Accountability, Office of",,,,,,,,,,,Office of Healthcare Accountability,"Healthcare Accountability, Office of",Office of Healthcare Accountability,,,,Active,Mayoral Office,,,Mayor's Office,Mayor's Office,New York City Charter,"Chapter 1, Section 20-q",https://codelibrary.amlegal.com/codes/newyorkcity/latest/NYCcharter/0-0-0-6615,"The mayor shall establish an office of healthcare accountability. Such office may be established as a standalone office or within any office of the mayor or within any department. Such office shall be headed by a director of healthcare accountability, who shall be appointed by the mayor or, if the office is established within an agency other than the office of the mayor, by the head of such agency.",,,,,,,,2023.0,,office-of-healthcare-accountability,2024-07-29,,,,,primary,,REC_000197,,healthcare office accountability,,nyc_agencies_export,,,primary
Office of Labor Standards,"Labor Standards, Office of",,,,,,,,,,,Office of Labor Standards,"Labor Standards, Office of",Office of Labor Standards,,,,Active,Division,,,Department of Consumer and Worker Protection,Department of Consumer and Worker Protection,New York City Charter,"Chapter 64, Section 2203(e)",https://codelibrary.amlegal.com/codes/newyorkcity/latest/NYCcharter/0-0-0-5706,The office of labor standards shall be established within the department. Such office shall be headed by a director who shall be appointed by the commissioner.,,,,,,,,2015.0,,office-of-labor-standards,2024-07-29,,,,,primary,,REC_000200,,labor office standards,,nyc_agencies_export,,,primary
Office of Long-Term Planning and Sustainability,"Long-Term Planning and Sustainability, Office of",,,,,,,,,,,Office of Long-Term Planning and Sustainability,"Long-Term Planning and Sustainability, Office of",Office of Long-Term Planning and Sustainability,,,,Reorganized,Mayoral Office,,,,,New York City Charter,"Chapter 1, Section 20",https://codelibrary.amlegal.com/codes/newyorkcity/latest/NYCcharter/0-0-0-6574,"The mayor shall establish an office of long-term planning and sustainability. Such office may, but need not, be established in the executive office of the mayor and may be established as a separate office or within any other office of the mayor or within any department the head of which is appointed by the mayor. Such office shall be headed by a director who shall be appointed by the mayor or by the head of such department. For the purposes of this section only, ""director"" shall mean the director of long-term planning and sustainability.",,,,,,,,,,office-of-long-term-planning-and-sustainability,2024-07-29,,,,,primary,,REC_000201,,long office-term planning and sustainability,,nyc_agencies_export,,,primary
Office of Marine Debris Disposal and Vessel Surrendering,"Marine Debris Disposal and Vessel Surrendering, Office of",,,,,,,,,,,Office of Marine Debris Disposal and Vessel Surrendering,"Marine Debris Disposal and Vessel Surrendering, Office of",Office of Marine Debris Disposal and Vessel Surrendering,,,,Active,Division,,,Department of Parks and Recreation,Department of Parks and Recreation,New York City Charter,"Chapter 1, Section 20-p",https://codelibrary.amlegal.com/codes/newyorkcity/latest/NYCcharter/0-0-0-6614,"The mayor shall establish an office of marine debris disposal and vessel surrendering. Such office may be established in the executive office of the mayor or may be established as a separate office, within any other office of the mayor or within any department, the head of which is appointed by the mayor. Such office shall be headed by a director, who shall be appointed by the mayor or the head of such department.",,,,,,,,2023.0,,office-of-marine-debris-disposal-and-vessel-surrendering,2024-07-29,,,,,primary,,REC_000203,,marine office debris disposal and vessel surrendering,,nyc_agencies_export,,,primary
Office of Neighborhood Safety,"Neighborhood Safety, Office of",,,,,,,,,,,Office of Neighborhood Safety,"Neighborhood Safety, Office of",Office of Neighborhood Safety,,Office for Neighborhood Safety and the Prevention of Gun Violence,Office for Neighborhood Safety and the Prevention of Gun Violence (partial),Active,Division,,,Mayor's Office of Criminal Justice,Mayor's Office of Criminal Justice,New York City Charter,"Chapter 1, Section 13-f",https://codelibrary.amlegal.com/codes/newyorkcity/latest/NYCcharter/0-0-0-5804,"The mayor shall establish an office for neighborhood safety and the prevention of gun violence. Such office may, but need not, be established in the executive office of the mayor and may be established as a separate office within any other office of the mayor. Such office shall be headed by a director who shall be appointed by the mayor. For the purposes of this section, the term ""director"" means the director of the office for neighborhood safety and the prevention of gun violence.",,,,,,,,2014.0,,office-of-neighborhood-safety,2024-07-29,,,,,primary,,REC_000204,,neighborhood office safety,,nyc_agencies_export,,,primary
Office of Recovery and Resiliency,"Recovery and Resiliency, Office of",,,,,,Office of Recovery & Resiliency,,,,,Office of Recovery and Resiliency,"Recovery and Resiliency, Office of",Office of Recovery and Resiliency,,,,Active,Division,,,Mayor's Office of Climate and Environmental Justice,Mayor's Office of Climate and Environmental Justice,Mayoral Executive Order,"Executive Order 4, 2022",https://a860-gpp.nyc.gov/concern/nyc_government_publications/st74cs877?locale=en,"The Office of Long-Term Planning and Sustainability shall be established within the Office of the Mayor and hereafter be designated as the Office of Climate and Environmental Justice, except in court documents, contracts and any other situation where the name “Office of Long-Term Planning and Sustainability” is legally required. Such office shall perform the functions delineated in section 20 of the Charter as well as those functions that have been performed by the former Office of Climate and Sustainability and the Office of Climate Resiliency.",,,,,,,,2014.0,,office-of-recovery-and-resiliency,2024-07-29,,,,,primary,,REC_000207,,recovery office and resiliency,,nyc_agencies_export,,,primary
Office of Street Vendor Enforcement,"Street Vendor Enforcement, Office of",,,,,,,,,,,Office of Street Vendor Enforcement,"Street Vendor Enforcement, Office of",Office of Street Vendor Enforcement,,,,Active,Division,,https://www.nyc.gov/site/dsny/what-we-do/cleaning/street-vending-enforcement.page,Department of Sanitation,Department of Sanitation,New York City Charter,"Chapter 1, Section 13-e",https://codelibrary.amlegal.com/codes/newyorkcity/latest/NYCcharter/0-0-0-125,"There shall be an office of street vendor enforcement, which shall consist of enforcement agents who are specially trained in local laws and rules related to vending on the streets and sidewalks of the city of New York. The office of street vendor enforcement shall be fully operational on or before September 1, 2021 and shall commence enforcement activities on or before such date. Such enforcement activities shall, at a minimum, include a sufficient number of street patrols to inspect or examine the vending activities of at least 75 percent of applicable permittees or licensees on an annual basis. For the purposes of this section, the term ""applicable permittees or licensees"" means persons issued full-term or temporary permits pursuant to section 17-307 of the administrative code, or persons issued licenses to vend pursuant to sections 17-307 or 17-307.1 of the administrative code, or licenses issued pursuant to section 20-456 of the administrative code. The mayor may establish such office in the executive office of the mayor, within any other office in the executive office of the mayor, or within any department, the head of which is appointed by the mayor.",,,,,,,,2021.0,,office-of-street-vendor-enforcement,2024-07-29,,,,,primary,,REC_000208,,street office vendor enforcement,,nyc_agencies_export,,,primary
Office of the Tenant Advocate,"Tenant Advocate, Office of the",,,,,,,,,,,Office of the Tenant Advocate,"Tenant Advocate, Office of the",Office of the Tenant Advocate,,,,Active,Division,,,Department of Buildings,Department of Buildings,New York City Charter,"Chapter 26, Section 650",https://codelibrary.amlegal.com/codes/newyorkcity/latest/NYCcharter/0-0-0-4650,"Establishment of the office of the tenant advocate. There shall be in the department an office of the tenant advocate, whose duties shall include, but not be limited to: 1.   monitoring tenant protection plans to ensure that such plans comply with the requirements of section 28-104.8.4 of the administrative code; 2.   establishing a system to receive comments, questions and complaints with respect to tenant protection plans, including, but not limited to, establishing and publicizing the availability of a telephone number to receive such comments, questions and complaints; 3.   establishing a system to communicate with tenants who are affected by work in occupied multiple dwellings to ensure that such tenants have notice of such work, understand the applicable tenant protection plan and understand their rights as tenants during such work; and 4.   monitoring sites with tenant protection plans to ensure that such sites are complying with such plans and, if the office finds that a site is not complying with such plan, making a recommendation to the commissioner to issue a stop work order for such site until such site is in compliance.",,,,,,,,2017.0,,office-of-the-tenant-advocate,2024-07-29,,,,,primary,,REC_000219,,the office tenant advocate,,nyc_agencies_export,,,primary
Taskforce on Racial Inclusion and Equity,"Racial Inclusion and Equity, Taskforce on",,,,Taskforce on Racial Inclusion & Equity (TRIE),,,,,,,Taskforce on Racial Inclusion and Equity (TRIE),"Racial Inclusion and Equity, Taskforce on (TRIE)",Taskforce on Racial Inclusion and Equity,,,,Active,"Advisory, Oversight, or Regulatory Body",,https://www.nyc.gov/site/trie/index.page,,Mayor's Office of Equity and Racial Justice,New York City Charter,"Chapter 78, Section 3402",https://codelibrary.amlegal.com/codes/newyorkcity/latest/NYCcharter/0-0-0-6482,There shall be a taskforce on racial inclusion and equity to function as an interagency coordination and leadership body for citywide racial equity policy development and implementation. The taskforce shall be located within the office of racial equity.,TRIE,,,,,,,2020.0,,taskforce-on-racial-inclusion-and-equity,2024-07-29,,,,,primary,,REC_000234,,taskforce on racial inclusion and equity,,nyc_agencies_export,,,primary
The Village Alliance,The Village Alliance,,,,The Village Alliance,,,,,,,The Village Alliance,The Village Alliance,The Village Alliance,,,,Active,Non-Governmental Organization,,https://greenwichvillage.nyc/,,,New York State Law,,,,,,,,,,,1993.0,,the-village-alliance,2024-07-29,,,,,primary,,REC_000238,,the village alliance,,nyc_agencies_export,,,primary
Times Square Alliance,Times Square Alliance,,,,Times Square Alliance (TSA),,,,,,,Times Square Alliance (TSA),Times Square Alliance (TSA),Times Square Alliance,,,,Active,Non-Governmental Organization,,https://www.timessquarenyc.org/,,,New York State Law,,,,TSA,,,,,,,1992.0,,times-square-alliance,2024-07-29,,,,,primary,,REC_000239,,times square alliance,,nyc_agencies_export,,,primary
