Name,NameAlphabetized,OperationalStatus,PreliminaryOrganizationType,Description,URL,ParentOrganization,NYCReportingLine,AuthorizingAuthority,LegalCitation,LegalCitationURL,LegalCitationText,LegalName,AlternateNames,Acronym,AlternateAcronyms,BudgetCode,PrincipalOfficerName,PrincipalOfficerTitle,OpenDatasetsURL,Notes,FoundingYear,SunsetYear,URISlug,DateCreated,DateModified,LastVerifiedDate,Name - NYC.gov Agency List,Name - NYC.gov Mayor's Office,Name - NYC Open Data Portal,Name - ODA,Name - CPO,Name - WeGov,Name - Greenbook,Name - Checkbook,NameWithAcronym,NameAlphabetizedWithAcronym,PrincipalOfficerGivenName,PrincipalOfficerFamilyName,NameNormalized,RecordID_x,RecordID_y,HeadOfOrganizationTitle,HeadOfOrganizationURL,Name - NYC.gov Redesign,RecordID,Name - Ops,data_source
Department of Health and Mental Hygiene,"Health and Mental Hygiene, Department of",Active,Mayoral Agency,The Department of Health and Mental Hygiene (DOHMH) protects and promotes the health and mental well being of all New Yorkers.,http://www.nyc.gov/health,Mayor's Office,Deputy Mayor for Health and Human Services,New York City Charter,"Chapter 22, Section 551",https://codelibrary.amlegal.com/codes/newyorkcity/latest/NYCcharter/0-0-0-2019,"There shall be a department of health and mental hygiene, the head of which shall be the commissioner of health and mental hygiene who shall be appointed by the mayor. The department shall have and exercise all powers of a local health department set forth in law. Notwithstanding any other provision of this charter to the contrary, the department shall be a social services district for purposes of the administration of health-related public assistance programs to the extent agreed upon by the department, the department of social services and the department of homeless services. Appropriations to the department for mental health, intellectual and developmental disability, and alcoholism services shall be set forth in the expense budget in separate and distinct units of appropriation. In determining the annual amount of city funds to be appropriated by the city for mental health, intellectual and developmental disability, and alcoholism services, the following provision shall apply: in the event that the executive budget proposes a decrease in city funds measured against the budget for the current fiscal year, as modified in accordance with section 107, for the units of appropriation for mental health, intellectual and developmental disability, and alcoholism services, the executive budget shall not propose a greater percentage decrease in city funds measured against the budget for the current fiscal year, as modified in accordance with section 107, for the units of appropriation for mental health, intellectual and developmental disability, and alcoholism services than has been proposed for the units of appropriation for public health services. If, however, in his or her discretion, the mayor determines that it is in the city's best interest to submit an executive budget at variance with the requirements of this provision, the mayor shall include an explanation of the basis for this variation as part of the budget message.",Department of Health and Mental Hygiene,NYC Health; Health Department,DOHMH,DOH,816.0,Dr. Ashwin Vasan,Commissioner,https://data.cityofnewyork.us/browse?Dataset-Information_Agency=Department+of+Health+and+Mental+Hygiene+%28DOHMH%29,"The Department of Health and Mental Hygiene (DOHMH) in New York City is commonly referred to by several names, including the Department of Health and Mental Hygiene, NYC Health, and the NYC Health Department. These various names are used interchangeably in official documents, public communications, and branding to refer to the same entity responsible for public health, mental health services, and environmental health in New York City. Despite the different names, all references point to the single department tasked with promoting and protecting the health of all New Yorkers.",1870.0,,department-of-health-and-mental-hygiene,2024-07-29,,,"Health and Mental Hygiene, Department of (DOHMH)","Health and Mental Hygiene, Department of (DOHMH)",Department of Health and Mental Hygiene (DOHMH),Department of Health and Mental Hygiene (DOHMH),Department of Health and Mental Hygiene,Department of Health and Mental Hygiene,"Health & Mental Hygiene, Department of",Department of Health and Mental Hygiene,Department of Health and Mental Hygiene (DOHMH),"Health and Mental Hygiene, Department of (DOHMH)",Ashwin,Vasan,health department and mental hygiene,REC_000054,,,,,REC_000109,,nyc_agencies_export
,,,,,,,,,,,,,,,,,,,,,,,,,,,,,,,,,,,,,,,health hospital,,REC_000128,President and CEO,https://www.nychealthandhospitals.org/?redirect,NYC Health + Hospital,REC_000110,,nyc_gov
,,,,,,,,,,,,,,,,,,,,,,,,,,,,,,,,,,,,,,,health hospitals,,,,,,REC_000116,NYC Health + Hospitals,ops
,,,,,,,,,,,,,,,,,,,,,,,,,,,,,,,,,,,,,,,health hospitals corporation board directors,,,,,,REC_000243,Health and Hospitals Corporation Board of Directors,ops
,,,,,,,,,,,,,,,,,,,,,,,,,,,,,,,,,,,,,,,health hospitals corporation personnel review board,,,,,,REC_000244,Health and Hospitals Corporation Personnel Review Board,ops
,,,,,,,,,,,,,,,,,,,,,,,,,,,,,,,,,,,,,,,hiv planning council,,,,,,REC_000245,HIV Planning Council,ops
,,,,,,,,,,,,,,,,,,,,,,,,,,,,,,,,,,,,,,,hivaids services advisory board,,,,,,REC_000241,HIV/AIDS Services Advisory Board,ops
New York City Housing Authority,"Housing Authority, New York City",Active,Authority or Public Benefit Corporation,"The New York City Housing Authority (NYCHA) provides affordable housing to nearly 420,000 low- and moderate-income City residents in 345 housing developments with 180,000 apartments in the five boroughs. Through federal rent subsidies (Section 8 Leased Housing Program), the Authority assists over 87,500 families in locating and renting housing in privately owned buildings. In addition, the Authority provides social services for its residents through 112 community centers, 42 senior centers, and a variety of programs.",http://www.nyc.gov/nycha,,"Deputy Mayor for Housing, Economic Development and Workforce",New York State Law,"Article 5, Section 63",https://www.nysenate.gov/legislation/laws/MHA/63,"Establishment and organizations of authorities. 1. An authority may be established by a county, city or first class village upon (i) the passage of a resolution by the local legislative body, authorizing the establishment of a housing authority and directing the mayor of the city or village, and in the case of counties, directing the county executive to file a certificate therefor; (ii) the filing by the mayor or county executive in the office of the board, and a duplicate in the office of the secretary of state, of a certificate signed by him and setting forth (a) the name of the authority; (b) the names of the members and their terms, specifying which member is chairman; and (c) a copy of the aforesaid resolution.",,,NYCHA,,,Lisa Bova-Hiatt,Chief Executive Officer,https://data.cityofnewyork.us/browse?Dataset-Information_Agency=New+York+City+Housing+Authority+%28NYCHA%29,,1934.0,,new-york-city-housing-authority,2024-07-29,,,"Housing Authority, New York City (NYCHA)","Housing Authority, New York City (NYCHA)",New York City Housing Authority (NYCHA),New York City Housing Authority (NYCHA),,NYC Housing Authority,"Housing Authority, NYC",,New York City Housing Authority (NYCHA),"Housing Authority, New York City (NYCHA)",Lisa,Bova-Hiatt,housing authority,REC_000175,REC_000069,Chief Execuitive Officer ,https://www.nyc.gov/site/nycha/index.page,"Housing Authority, New York City (NYCHA)",REC_000121,NYC Housing Authority,ops
,,,,,,,,,,,,,,,,,,,,,,,,,,,,,,,,,,,,,,,housing authority board,,,,,,REC_000294,New York City Housing Authority Board,ops
Housing Development Corporation,Housing Development Corporation,Active,Authority or Public Benefit Corporation,"The New York City Housing Development Corporation (HDC) seeks to increase the supply of multi-family housing, stimulate economic growth and revitalize neighborhoods by financing the creation and preservation of affordable housing for low- , moderate- , and middle-income New Yorkers.",https://www.nychdc.com/,,"Deputy Mayor for Housing, Economic Development and Workforce",New York State Law,,,,,,NYC HDC,,,Eric Enderlin,President,,,1971.0,,housing-development-corporation,2024-07-29,,,Housing Development Corporation (NYC HDC),Housing Development Corporation (NYC HDC),,Housing Development Corporation (HDC),,Housing Development Corporation,"Housing Development Corporation, NYC",,Housing Development Corporation (NYC HDC),Housing Development Corporation (NYC HDC),Eric,Enderlin,housing development corporation,REC_000093,,,,,REC_000242,Housing Development Corporation,ops
,,,,,,,,,,,,,,,,,,,,,,,,,,,,,,,,,,,,,,,housing preservation development,,,,,,REC_000117,Housing Preservation and Development,ops
,,,,,,,,,,,,,,,,,,,,,,,,,,,,,,,,,,,,,,,housing recovery operations,,REC_000072,Executive Director ,https://www.nyc.gov/site/recovery/index.page,Housing Recovery Operations (HRO),REC_000118,,nyc_gov
,,,,,,,,,,,,,,,,,,,,,,,,,,,,,,,,,,,,,,,hudson river park trust,,,,,,REC_000246,Hudson River Park Trust,ops
,,,,,,,,,,,,,,,,,,,,,,,,,,,,,,,,,,,,,,,hudson river valley greenway communities council,,,,,,REC_000247,Hudson River Valley Greenway Communities Council,ops
Hudson Yards Infrastructure Corporation,Hudson Yards Infrastructure Corporation,Active,Authority or Public Benefit Corporation,"The Hudson Yards Infrastructure Corporation is a local development corporation created in 2005 by the City of New York to finance certain property acquisition and infrastructure work, including the extension of the No. 7 subway line, as part of the development of the Hudson Yards Financing District.",http://www.nyc.gov/hyic,,,New York State Law,,,,,,,,,David Womack,President,,,2005.0,,hudson-yards-infrastructure-corporation,2024-07-29,,,Hudson Yards Infrastructure Corporation,Hudson Yards Infrastructure Corporation,,,,,,,Hudson Yards Infrastructure Corporation,Hudson Yards Infrastructure Corporation,David,Womack,hudson yards infrastructure corporation,REC_000094,,,,,REC_000248,Hudson Yards Infrastructure Corporation,ops
,,,,,,,,,,,,,,,,,,,,,,,,,,,,,,,,,,,,,,,hurricane sandy charitable organizations houses worship recovery taskforce,,,,,,REC_000337,Hurricane Sandy Charitable Organizations and Houses of Worship Recovery Taskforce,ops
,,,,,,,,,,,,,,,,,,,,,,,,,,,,,,,,,,,,,,,independent budget,,REC_000077,Director,IBO - Independent Budget Office (nyc.ny.us),"Independent Budget Office, NYC (IBO)",REC_000401,Independent Budget Office,ops
Independent Budget Office,Independent Budget Office,Active,"Advisory, Oversight, or Regulatory Body","The Independent Budget Office provides non-partisan budgetary, economic, and policy analysis for New York City residents and elected officials, and increases the visibility of the budget process.",http://www.ibo.nyc.ny.us/index.html,,Independent,New York City Charter,"Chapter 11, Section 259",https://codelibrary.amlegal.com/codes/newyorkcity/latest/NYCcharter/0-0-0-1263,"There shall be an independent budget office to be headed by a director who shall be appointed upon the recommendation of the independent budget office advisory board, by a special committee convened for this purpose. Such committee shall consist of the comptroller, the public advocate, a borough president chosen by the borough presidents, and a council member chosen by the council, and shall act by majority vote.",,,IBO,,132.0,Louisa Chafee,Director,https://data.cityofnewyork.us/browse?Dataset-Information_Agency=NYC+Independent+Budget+Office+%28IBO%29,,1989.0,,independent-budget-office,2024-07-29,,,"Independent Budget Office, NYC (IBO)","Independent Budget Office, NYC (IBO)",NYC Independent Budget Office (IBO),Independent Budget Office (IBO),Independent Budget Office,Independent Budget Office,"Independent Budget Office, NYC",Independent Budget Office,Independent Budget Office (IBO),Independent Budget Office (IBO),Louisa,Chafee,independent budget office,REC_000096,,,,,REC_000123,,nyc_agencies_export
,,,,,,,,,,,,,,,,,,,,,,,,,,,,,,,,,,,,,,,industrial development agency,,,,,,REC_000250,Industrial Development Agency,ops
Office of Innovation and Delivery,"Innovation and Delivery, Office of",Reorganized,Mayoral Office,,,,,Mayoral Executive Order,"Executive Order 5, 2022",https://a860-gpp.nyc.gov/concern/nyc_government_publications/gm80hx70d?locale=en,"Establishes the titles, duties, and responsibilities of the six Deputy Mayors, the Chief of Staff to the Mayor, and the Chief Counsel to the mayor and City Hall. Revokes Executive Order No. 56, dated March 21, 2021.",,,,,,,,,The Executive Order that established this office (No 5 or 2022) was revoked by Executive Order 29 of 2023. The new Executive Order does not include the Office of Innovation and Delivery.,,,office-of-innovation-and-delivery,2024-07-29,,,,,,,,Office of Innovation and Delivery,,,Office of Innovation and Delivery,"Innovation and Delivery, Office of",,,innovation office and delivery,REC_000198,,,,,REC_000127,,nyc_agencies_export
Interagency Coordinating Council,Interagency Coordinating Council,Active,"Advisory, Oversight, or Regulatory Body",,,Department of Youth and Community Development,Department of Youth and Community Development,New York City Charter,"Chapter 30, Section 735",https://codelibrary.amlegal.com/codes/newyorkcity/latest/NYCcharter/0-0-0-6850,"There shall be an interagency coordinating council established by the mayor which shall consist of representatives of each city agency providing services to youth, representatives from the youth board established pursuant to section seven hundred thirty-four of this chapter and a representative of the city council who shall be appointed by the speaker of the city council. The mayor, or his or her designee, shall serve as chairperson of the interagency coordinating council and shall preside over all meetings. The commissioner shall serve as director of the interagency coordinating council.",,,,,,,,,,1988.0,,interagency-coordinating-council,2024-07-29,,,,,,,,,,,Interagency Coordinating Council,Interagency Coordinating Council,,,interagency coordinating council,REC_000098,,,,,REC_000128,,nyc_agencies_export
,,,,,,,,,,,,,,,,,,,,,,,,,,,,,,,,,,,,,,,intergovernmental affairs mayors,,REC_000079,Director,Mayor's Office of Intergovernmental Affairs (nyc.gov),"Intergovernmental Affairs, Mayors Office of (MOIGA)",REC_000129,,nyc_gov
,,,,,,,,,,,,,,,,,,,,,,,,,,,,,,,,,,,,,,,jamaica bay rockaway parks conservancy inc,,,,,,REC_000255,Jamaica Bay Rockaway Parks Conservancy Inc,ops
,,,,,,,,,,,,,,,,,,,,,,,,,,,,,,,,,,,,,,,jamaica bay task force,,,,,,REC_000256,Jamaica Bay Task Force,ops
,,,,,,,,,,,,,,,,,,,,,,,,,,,,,,,,,,,,,,,jewish advisory council,,,,,,REC_000252,Jewish Advisory Council,ops
,,,,,,,,,,,,,,,,,,,,,,,,,,,,,,,,,,,,,,,judiciary mayors advisory committee,,REC_000081,Executive Director ,Advisory Committee on the Judiciary (nyc.gov),"Judiciary, Mayors Advisory Committee on the (MACJ)",REC_000130,,nyc_gov
,,,,,,,,,,,,,,,,,,,,,,,,,,,,,,,,,,,,,,,juvenile justice advisory board,,,,,,REC_000258,Juvenile Justice Advisory Board,ops
,,,,,,,,,,,,,,,,,,,,,,,,,,,,,,,,,,,,,,,kings county public administrator,,,,,,REC_000402,Kings County Public Administrator,ops
Office of Labor Relations,"Labor Relations, Office of",Active,Mayoral Office,The Office of Labor Relations represents the Mayor in all labor relations between the City of New York and labor organizations representing employees of the City. The Office Commissioner also administers a variety of programs for City Employees.,http://www.nyc.gov/olr,Mayor's Office,Chief Counsel to the Mayor and City Hall,New York City Charter,"Chapter 54, Section 1170",https://codelibrary.amlegal.com/codes/newyorkcity/latest/NYCcharter/0-0-0-3430,"There shall be an office of collective bargaining, the head of which shall be the director of such office, who shall be the person holding the office of chairman of the board of collective bargaining. The director may appoint, and at pleasure remove, two deputies.",,,OLR,,,Renee Campion,Commissioner,https://data.cityofnewyork.us/browse?Dataset-Information_Agency=Office+of+Labor+Relations+%28OLR%29,,1990.0,,office-of-labor-relations,2024-07-29,,,"Labor Relations, NYC Office of (OLR)","Labor Relations, NYC Office of (OLR)",Office of Labor Relations (OLR),Office of Labor Relations (OLR),Office of Labor Relations,Office of Labor Relations,"Labor Relations, Office of",,Office of Labor Relations (OLR),"Labor Relations, Office of (OLR)",Renee,Campion,labor office relations,REC_000199,,,,,REC_000131,,nyc_agencies_export
Office of Labor Standards,"Labor Standards, Office of",Active,Division,,,Department of Consumer and Worker Protection,Department of Consumer and Worker Protection,New York City Charter,"Chapter 64, Section 2203(e)",https://codelibrary.amlegal.com/codes/newyorkcity/latest/NYCcharter/0-0-0-5706,The office of labor standards shall be established within the department. Such office shall be headed by a director who shall be appointed by the commissioner.,,,,,,,,,,2015.0,,office-of-labor-standards,2024-07-29,,,,,,,,,,,Office of Labor Standards,"Labor Standards, Office of",,,labor office standards,REC_000200,,,,,REC_000132,,nyc_agencies_export
,,,,,,,,,,,,,,,,,,,,,,,,,,,,,,,,,,,,,,,land development corporation,,,,,,REC_000261,Land Development Corporation,ops
Landmarks Preservation Commission,Landmarks Preservation Commission,Active,"Advisory, Oversight, or Regulatory Body","The Landmarks Preservation Commission protects and preserves the historically and architecturally significant neighborhoods, buildings and sites that tell the collective story of New York City.   ",http://www.nyc.gov/landmarks,,"Deputy Mayor for Housing, Economic Development and Workforce",New York City Charter,"Chapter 74, Section 3020",https://codelibrary.amlegal.com/codes/newyorkcity/latest/NYCcharter/0-0-0-4431,"There shall be a landmarks preservation commission consisting of eleven members. The membership of such commission shall include at least three architects, one historian qualified in the field, one city planner or landscape architect, and one realtor. The membership shall include at least one resident of each of the five boroughs.",,,LPC,,136.0,Sarah Carroll,Chair,https://data.cityofnewyork.us/browse?Dataset-Information_Agency=Landmarks+Preservation+Commission+%28LPC%29,,1962.0,,landmarks-preservation-commission,2024-07-29,,,Landmarks Preservation Commission (LPC),Landmarks Preservation Commission (LPC),Landmarks Preservation Commission (LPC),Landmarks Preservation Commission (LPC),Landmarks Preservation Commission,Landmarks Preservation Commission,Landmarks Preservation Commission,Landmarks Preservation Commission,Landmarks Preservation Commission (LPC),Landmarks Preservation Commission (LPC),Sarah,Carroll,landmarks preservation commission,REC_000099,REC_000083,Chair,Landmarks Preservation Commission (nyc.gov),Landmarks Preservation Commission (LPC),REC_000265,Landmarks Preservation Commission,ops
Latin Media and Entertainment Commission,Latin Media and Entertainment Commission,Active,"Advisory, Oversight, or Regulatory Body",,,,Independent,Mayoral Executive Order,"Executive Order 43, 2003",https://a860-gpp.nyc.gov/concern/nyc_government_publications/9k41zd787?locale=en,This Executive Order by the Mayor announces the establishment of the Commission on Latin Media and Entertainment.,,,LMEC,,,,,https://data.cityofnewyork.us/browse?Dataset-Information_Agency=Latin+Media+%26+Entertainment+Commission+%28LMEC%29,,2003.0,,latin-media-and-entertainment-commission,2024-07-29,,,,,Latin Media & Entertainment Commission (LMEC),,,,,,Latin Media and Entertainment Commission (LMEC),Latin Media and Entertainment Commission (LMEC),,,latin media and entertainment commission,REC_000100,,,,,REC_000133,,nyc_agencies_export
,,,,,,,,,,,,,,,,,,,,,,,,,,,,,,,,,,,,,,,latin media entertainment commission,,,,,,REC_000259,Latin Media and Entertainment Commission,ops
,,,,,,,,,,,,,,,,,,,,,,,,,,,,,,,,,,,,,,,library brooklyn public,,REC_000085,President & CEO,Brooklyn Public Library (bklynlibrary.org),"Library, Brooklyn Public (BPL)",REC_000134,,nyc_gov
,,,,,,,,,,,,,,,,,,,,,,,,,,,,,,,,,,,,,,,library new york public,,REC_000086,President & CEO,The New York Public Library (nypl.org),"Library, New York Public (NYPL)",REC_000135,,nyc_gov
,,,,,,,,,,,,,,,,,,,,,,,,,,,,,,,,,,,,,,,library queens public,,REC_000087,President & CEO,https://www.queenslibrary.org/,"Library, Queens Public (QL)",REC_000136,,nyc_gov
,,,,,,,,,,,,,,,,,,,,,,,,,,,,,,,,,,,,,,,local conditional release commission,,,,,,REC_000260,Local Conditional Release Commission,ops
New York City Loft Board,"Loft Board, New York City",Active,"Advisory, Oversight, or Regulatory Body","The New York City Loft Board resolves issues regarding the legalization for residential use of buildings under the Board's jurisdiction (known as interim multiple dwellings or IMDs), adjudicates proceedings resulting from applications filed by IMD owners and tenants, and enforces minimum housing maintenance standards for IMD buildings.",http://www.nyc.gov/loftboard,,Independent,New York State Law,"Chapter 61-A, Article 7-C, Section 282",https://www.nysenate.gov/legislation/laws/MDW/282,"Establishment of special loft unit. 1. In order to resolve complaints of owners of interim multiple dwellings and of residential occupants of such buildings qualified for the protection of this article, and to act upon hardship applications made pursuant to this article, a special loft unit referred to herein as the ""loft board"" shall be established which shall consist of from four to nine members representative of the public, the real estate industry, loft residential tenants, and loft manufacturing interests, and a chairperson, all to be appointed by the mayor of the municipality and to serve such terms as he may designate. The compensation of the members of the loft board shall be fixed by the mayor. The members of the loft board shall not be considered employees of the state or the municipality, provided, however, that state or municipal employees or officers may be named to the loft board. The mayor shall establish the loft board within ninety days of the effective date of chapter three hundred forty-nine of the laws of nineteen hundred eighty-two. The loft board shall have such office and staff as shall be necessary to carry out functions conferred upon it and may request and receive assistance from any state or municipal agency or department. The loft board shall have the following duties: (i) the determination of interim multiple dwelling status and other issues of coverage pursuant to this article; (ii) the resolution of all hardship appeals brought under this article; (iii) the determination of any claim for rent adjustment under this article by an owner or tenant; (iv) the issuance, after a public hearing, and the enforcement of rules and regulations governing minimum housing maintenance standards in interim multiple dwellings (subject to the provisions of this chapter and any local building code), rent adjustments prior to legalization, compliance with this article and the hearing of complaints and applications made to it pursuant to this article; and (v) determination of controversies arising over the fair market value of a residential tenant's fixtures or reasonable moving expenses.",,,LOFT,,,Martha Cruz,Executive Director,,,1982.0,,new-york-city-loft-board,2024-07-29,,,Loft Board (LOFT),Loft Board (LOFT),,,,New York City Loft Board,,,New York City Loft Board (LOFT),"Loft Board, New York City (LOFT)",Martha,Cruz,loft board,REC_000162,REC_000088,Executive Director & General Counsel ,https://www.nyc.gov/site/loftboard/index.page,Loft Board (LOFT),REC_000264,Loft Board,ops
Lower Manhattan Development Corporation,Lower Manhattan Development Corporation,Active,Authority or Public Benefit Corporation,,http://www.renewnyc.com/,,,New York State Law,,,,,,,,,,,,,2001.0,,lower-manhattan-development-corporation,2024-07-29,,,,,,,,,Lower Manhattan Development Corporation,,Lower Manhattan Development Corporation,Lower Manhattan Development Corporation,,,lower manhattan development corporation,REC_000102,,,,,REC_000263,Lower Manhattan Development Corporation,ops
Made in New York,Made in New York,Active,Non-Governmental Organization,,https://www.madeinnyc.org/,,,New York State Law,,,,,,MINY,,,,,,,2005.0,,made-in-new-york,2024-07-29,,,,,,Made in New York (MINY),,,,,Made in New York (MINY),Made in New York (MINY),,,made in new york,REC_000103,,,,,REC_000138,,nyc_agencies_export
,,,,,,,,,,,,,,,,,,,,,,,,,,,,,,,,,,,,,,,marshall plan moms task force,,,,,,REC_000275,Marshall Plan for Moms Task Force,ops
,,,,,,,,,,,,,,,,,,,,,,,,,,,,,,,,,,,,,,,mayor advisory committee judiciary,,,,,,REC_000266,Mayor's Advisory Committee on the Judiciary,ops
,,,,,,,,,,,,,,,,,,,,,,,,,,,,,,,,,,,,,,,mayor committee city marshals,,REC_000089,Chair,https://www.nyc.gov/site/marshals/index.page,Mayor's Committee on City Marshals (MCCM),REC_000269,Mayor's Committee on City Marshals,ops
,,,,,,,,,,,,,,,,,,,,,,,,,,,,,,,,,,,,,,,mayor fund board advisors,,,,,,REC_000267,Mayor's Fund Board of Advisors,ops
,,,,,,,,,,,,,,,,,,,,,,,,,,,,,,,,,,,,,,,mayor fund board directors,,,,,,REC_000268,Mayor's Fund Board of Directors,ops
