Name,NameAlphabetized,OperationalStatus,PreliminaryOrganizationType,Description,URL,ParentOrganization,NYCReportingLine,AuthorizingAuthority,LegalCitation,LegalCitationURL,LegalCitationText,LegalName,AlternateNames,Acronym,AlternateAcronyms,BudgetCode,PrincipalOfficerName,PrincipalOfficerTitle,OpenDatasetsURL,Notes,FoundingYear,SunsetYear,URISlug,DateCreated,DateModified,LastVerifiedDate,Name - NYC.gov Agency List,Name - NYC.gov Mayor's Office,Name - NYC Open Data Portal,Name - ODA,Name - CPO,Name - WeGov,Name - Greenbook,Name - Checkbook,NameWithAcronym,NameAlphabetizedWithAcronym,PrincipalOfficerGivenName,PrincipalOfficerFamilyName,NameNormalized,RecordID_x,RecordID_y,HeadOfOrganizationTitle,HeadOfOrganizationURL,Name - NYC.gov Redesign,RecordID,Name - Ops,data_source
Conflicts of Interest Board,Conflicts of Interest Board,Active,"Advisory, Oversight, or Regulatory Body",The Conflicts of Interest Board administers the City's conflicts of interest and financial disclosure laws.,http://www.nyc.gov/conflicts,,Chief Counsel to the Mayor and City Hall,New York City Charter,"Chapter 68, Section 2602",https://codelibrary.amlegal.com/codes/newyorkcity/latest/NYCcharter/0-0-0-6596,"There shall be a conflicts of interest board consisting of five members. Three members shall be appointed by the mayor, one member shall be appointed by the public advocate, and one member shall be appointed by the comptroller. All members shall be appointed with the advice and consent of the council. The mayor shall designate a chair.",,,COIB,,312.0,Carolyn Miller,Executive Director,https://data.cityofnewyork.us/browse?Dataset-Information_Agency=Conflicts+of+Interest+Board+%28COIB%29,,1989.0,,conflicts-of-interest-board,2024-07-29,,,Conflicts of Interest Board (COIB),Conflicts of Interest Board (COIB),Conflicts of Interest Board (COIB),Conflicts of Interest Board (COIB),Conflicts of Interest Board,Conflicts of Interest Board,Conflicts of Interest Board,Conflicts of Interest Board,Conflicts of Interest Board (COIB),Conflicts of Interest Board (COIB),Carolyn,Miller,conflicts of interest board,REC_000041,,,,,REC_000065,,nyc_agencies_export
Department of Consumer and Worker Protection,"Consumer and Worker Protection, Department of",Active,Mayoral Agency,The NYC Department of Consumer and Worker Protection (DCWP)—formerly the Department of Consumer Affairs (DCA)—protects and enhances the daily economic lives of New Yorkers to create thriving communities.,https://www1.nyc.gov/site/dca/index.page,Mayor's Office,"Deputy Mayor for Housing, Economic Development and Workforce",New York City Charter,"Chapter 64, Section 2203",https://codelibrary.amlegal.com/codes/newyorkcity/latest/NYCcharter/0-0-0-5704,"There shall be a department of consumer and worker protection, the head of which shall be the commissioner of consumer and worker protection.",,Department of Consumer Affairs,DCWP,DCA,866.0,Vilda Vera Mayuga,Commissioner,https://data.cityofnewyork.us/browse?Dataset-Information_Agency=Department+of+Consumer+and+Worker+Protection+%28DCWP%29,,1969.0,,department-of-consumer-and-worker-protection,2024-07-29,,,"Consumer and Worker Protection, Department of (DCWP)","Consumer and Worker Protection, Department of (DCWP)",Department of Consumer and Worker Protection (DCWP),Department of Consumer and Worker Protection (DCWP),Department of Consumer and Worker Protection,Department of Consumer and Worker Protection,Consumer and Worker Protection,Department of Consumer & Worker Protection,Department of Consumer and Worker Protection (DCWP),"Consumer and Worker Protection, Department of (DCWP)",Vilda,Mayuga,consumer department and worker protection,REC_000047,,,,,REC_000066,,nyc_agencies_export
,,,,,,,,,,,,,,,,,,,,,,,,,,,,,,,,,,,,,,,consumer department worker protection,,,,,,REC_000091,Department of Consumer and Worker Protection,ops
,,,,,,,,,,,,,,,,,,,,,,,,,,,,,,,,,,,,,,,consumer worker protection department,,REC_000040,Commissioner,https://www.nyc.gov/site/dca/index.page,"Consumer and Worker Protection, Department of (DCWP)",REC_000067,,nyc_gov
,,,,,,,,,,,,,,,,,,,,,,,,,,,,,,,,,,,,,,,contract services mayor,,REC_000041,Director,https://www.nyc.gov/site/mocs/index.page,"Contract Services, Mayor's Office of (MOCS)",REC_000068,,nyc_gov
,,,,,,,,,,,,,,,,,,,,,,,,,,,,,,,,,,,,,,,convention center development corporation,,,,,,REC_000183,Convention Center Development Corporation,ops
,,,,,,,,,,,,,,,,,,,,,,,,,,,,,,,,,,,,,,,convention center operating corporation,,,,,,REC_000186,Convention Center Operating Corporation (Javits),ops
,,,,,,,,,,,,,,,,,,,,,,,,,,,,,,,,,,,,,,,conversions task force,,,,,,REC_000308,Office Conversions Task Force,ops
,,,,,,,,,,,,,,,,,,,,,,,,,,,,,,,,,,,,,,,correction board,,REC_000042,Executive Director ,https://www.nyc.gov/site/boc/index.page,"Correction, Board of (BOC)",REC_000069,,nyc_gov
Department of Correction,"Correction, Department of",Active,Mayoral Agency,"The Department of Correction operates ten jails on Rikers Island and additional facilities and court pens throughout the city.  It houses an average daily population of approximately 12,500 inmates.",http://www.nyc.gov/doc,Mayor's Office,Deputy Mayor for Public Safety,New York City Charter,"Chapter 25, Section 623",https://codelibrary.amlegal.com/codes/newyorkcity/latest/NYCcharter/0-0-0-2201,There shall be a department of correction the head of which shall be the commissioner of correction.,,,DOC,,72.0,Lynelle Maginley-Liddie,Commissioner,https://data.cityofnewyork.us/browse?Dataset-Information_Agency=Department+of+Correction+%28DOC%29,,1895.0,,department-of-correction,2024-07-29,,,"Correction, Department of (DOC)","Correction, Department of (DOC)",Department of Correction (DOC),Department of Correction (DOC),Department of Correction,Department of Correction,"Correction, Department of",Department of Correction,Department of Correction (DOC),"Correction, Department of (DOC)",Lynelle,Maginley-Liddie,correction department,REC_000048,REC_000043,Commissioner ,https://www.nyc.gov/site/doc/index.page,"Correction, Department of (DOC)",REC_000096,Department of Correction,ops
Office of Correspondence,"Correspondence, Office of",Active,Mayoral Office,,,Mayor's Office,Mayor's Office Chief of Staff,Mayoral Executive Order,"Executive Order 29, 2023",https://a860-gpp.nyc.gov/concern/nyc_government_publications/pc289n032?locale=en,"there shall be six Deputy Mayors, a Chief Housing Officer, Chief Technology Officer, Chief Efficiency Officer, Chief of Staff, Chief Advisor, Chief Counsel to the Mayor, Dir. of Intergovernmental; etc.",,,,,,,,,,,,office-of-correspondence,2024-07-29,,,,,,,,,,,Office of Correspondence,"Correspondence, Office of",,,correspondence office,REC_000253,,,,,REC_000070,,nyc_agencies_export
,,,,,,,,,,,,,,,,,,,,,,,,,,,,,,,,,,,,,,,council airport opportunity board directors,,,,,,REC_000178,Council for Airport Opportunity Board of Directors,ops
New York City Courts,"Courts, New York City",Active,Judiciary,,https://www.nycourts.gov/,,,New York State,,,,,,,,,,,,,1962.0,,new-york-city-courts,2024-07-29,,,,,,,,,New York City Courts,,New York City Courts,"Courts, New York City",,,courts,REC_000160,,,,,REC_000071,,nyc_agencies_export
Office of Creative Communications,"Creative Communications, Office of",Active,Mayoral Office,,,Mayor's Office,Deputy Mayor for Communications,Press Release,"August 14, 2023 Press Release",https://www.nyc.gov/office-of-the-mayor/news/593-23/mayor-adams-appoints-fabien-levy-deputy-mayor-communications#/0,"Reporting to Deputy Mayor Levy will be City Hall’s communications director, press secretary, director of the office of community and ethnic media, research director, and senior advisor for creative communications. Levy will also work closely with communications and press staff across all of city government.",,,,,,,,,,2019.0,,office-of-creative-communications,2024-07-29,,,,,,,,,,,Office of Creative Communications,"Creative Communications, Office of",,,creative office communications,REC_000259,,,,,REC_000072,,nyc_agencies_export
Office of Crime Victim Services,"Crime Victim Services, Office of",Active,Division,,https://criminaljustice.cityofnewyork.us/programs/ocvs/,Mayor's Office of Criminal Justice,Mayor's Office of Criminal Justice,New York City Charter,"Chapter 1, Section 13-d",https://codelibrary.amlegal.com/codes/newyorkcity/latest/NYCcharter/0-0-0-108,"The mayor shall establish an office of crime victim services. Such office may, but need not, be established in the executive office of the mayor, or may be established as a separate office within any other office of the mayor, or within any department, the head of which is appointed by the mayor. Such office shall be headed by a coordinator who shall be appointed by the mayor or the head of such department.",,,,,,,,,,2017.0,,office-of-crime-victim-services,2024-07-29,,,,,,,,,,,Office of Crime Victim Services,"Crime Victim Services, Office of",,,crime office victim services,REC_000192,,,,,REC_000073,,nyc_agencies_export
,,,,,,,,,,,,,,,,,,,,,,,,,,,,,,,,,,,,,,,criminal justice mayor,,REC_000045,Director,https://criminaljustice.cityofnewyork.us/,"Criminal Justice, Mayor's Office of",REC_000074,,nyc_gov
,,,,,,,,,,,,,,,,,,,,,,,,,,,,,,,,,,,,,,,cultural affairs advisory commission,,,,,,REC_000173,Cultural Affairs Advisory Commission,ops
,,,,,,,,,,,,,,,,,,,,,,,,,,,,,,,,,,,,,,,cultural affairs department,,REC_000046,Commissioner,https://www.nyc.gov/site/dcla/index.page,"Cultural Affairs, Department of (DCLA)",REC_000075,,nyc_gov
Department of Cultural Affairs,"Cultural Affairs, Department of",Active,Mayoral Agency,"The Department of Cultural Affairs (DCLA) ensures that cultural activities are an integral part of New York City’s civic and economic life by providing support, advocacy and technical assistance for the City’s cultural community. DCLA’s constituency consists of the 34 City-owned cultural institutions comprising the Cultural Institutions Group (CIG) and more than 1,500 other not-for-profit organizations serving constituencies in all neighborhoods of the City. DCLA also provides donated materials for arts programs offered by the public schools and cultural and social service groups, and commissions works of public art at Cityfunded construction projects throughout the City.",http://www.nyc.gov/culture,Mayor's Office,"Deputy Mayor for Housing, Economic Development and Workforce",New York City Charter,"Chapter 67, Section 2503",https://codelibrary.amlegal.com/codes/newyorkcity/latest/NYCcharter/0-0-0-3974,"There shall be a department of cultural affairs, the head of which shall be the commissioner of cultural affairs.",,,DCLA,,126.0,Laurie Cumbo,Commissioner,https://data.cityofnewyork.us/browse?Dataset-Information_Agency=Department+of+Cultural+Affairs+%28DCLA%29,,1962.0,,department-of-cultural-affairs,2024-07-29,,,"Cultural Affairs, Department of (DCLA)","Cultural Affairs, Department of (DCLA)",Department of Cultural Affairs (DCLA),Department of Cultural Affairs (DCLA),Department of Cultural Affairs,Department of Cultural Affairs,Cultural Affairs,Department of Cultural Affairs,Department of Cultural Affairs (DCLA),"Cultural Affairs, Department of (DCLA)",Laurie,Cumbo,cultural department affairs,REC_000049,,,,,REC_000089,Department of Cultural Affairs,ops
,,,,,,,,,,,,,,,,,,,,,,,,,,,,,,,,,,,,,,,cultural institutions retirement system board trustees,,,,,,REC_000195,Cultural Institutions Retirement System Board of Trustees,ops
Cyber Command,Cyber Command,Active,Division,,https://www.nyc.gov/content/oti/pages/meet-the-team/cyber-command,Office of Technology and Innovation,Office of Technology and Innovation,New York City Charter,"Chapter 1, Section 20-j",https://codelibrary.amlegal.com/codes/newyorkcity/latest/NYCcharter/0-0-0-5726,The mayor shall establish an office of cyber command. Such office may be established in the executive office of the mayor or as a separate office or within any department the head of which is appointed by the mayor. Such office shall be headed by a director who shall be appointed by the mayor or the head of such department and who shall serve as the chief information security officer of the city.,,,NYC3,,,,,,"NYC Cyber Command was integrated into the Office of Technology and Innovation (OTI) in November 2021 through Executive Order No. 3. This integration was part of a broader initiative to streamline and enhance the city's technology and innovation efforts by merging several technology-focused entities, including the NYC Office of Data Analytics (ODA), the Mayor's Office of the Chief Technology Officer (MOCTO), the Mayor's Office of Information Privacy (MOIP), and NYC 311. While the Department of Information Technology and Telecommunications (DoITT) continues to exist solely for legal contract purposes, its operational functions, including those of NYC Cyber Command, have been incorporated into OTI. This consolidation aims to create a unified approach to technology deployment and innovation, improving service efficiency and coordination across NYC government agencies.",2017.0,,cyber-command,2024-07-29,,,,,,NYC Cyber Command (NYC3),,NYC Cyber Command,,,Cyber Command (NYC3),Cyber Command (NYC3),,,cyber command,REC_000172,,,,,REC_000076,,nyc_agencies_export
,,,,,,,,,,,,,,,,,,,,,,,,,,,,,,,,,,,,,,,dangerous dog advisory board,,,,,,REC_000214,Dangerous Dog Advisory Board,ops
Office of Data Analytics,"Data Analytics, Office of",Active,Division,,https://www.nyc.gov/content/oti/pages/data-analytics,Office of Technology and Innovation,Office of Technology and Innovation,New York City Charter,"Chapter 1, Section 20-f",https://codelibrary.amlegal.com/codes/newyorkcity/latest/NYCcharter/0-0-0-5025,"The mayor shall establish an office of data analytics. Such office may be established in the executive office of the mayor and may be established as a separate office or within any other office of the mayor or within any department the head of which is appointed by the mayor. Such office shall be headed by a director who shall be appointed by the mayor or head of such department and who shall serve as the city's chief analytics officer and chief open platform officer, as defined in the open data policy and technical standards manual.",,Mayor's Office of Data Analytics,ODA,MODA,,,,,"The NYC Office of Data Analytics (ODA) was integrated into the Office of Technology and Innovation (OTI) in November 2021 through Executive Order No. 3. This integration was part of a broader initiative to streamline and enhance the city's technology and innovation efforts by merging several technology-focused entities, including NYC Cyber Command, the Mayor's Office of the Chief Technology Officer (MOCTO), the Mayor's Office of Information Privacy (MOIP), and NYC 311. While the Department of Information Technology and Telecommunications (DoITT) continues to exist solely for legal contract purposes, its operational functions, including those of the ODA, have been incorporated into OTI. This consolidation aims to create a unified approach to technology deployment and innovation, improving service efficiency and coordination across NYC government agencies.",2013.0,,office-of-data-analytics,2024-07-29,,,,,,Office of Data Analytics (ODA),,Office of Data Analytics,,,Office of Data Analytics (ODA),"Data Analytics, Office of (ODA)",,,data office analytics,REC_000193,,,,,REC_000077,,nyc_agencies_export
,,,,,,,,,,,,,,,,,,,,,,,,,,,,,,,,,,,,,,,deferred compensation board,,,,,,REC_000213,Deferred Compensation Board,ops
,,,,,,,,,,,,,,,,,,,,,,,,,,,,,,,,,,,,,,,department aging,,,,,,REC_000094,Department for the Aging,ops
Department for the Aging,"Aging, Department for the",Active,Mayoral Agency,"NYC Aging funds community-based organizations throughout the five boroughs to provided essential services for seniors, including hot meals and activities at senior centers, home-delivered meals, case management, home care, transportation, legal services and caregiver services.    ",http://www.nyc.gov/aging,Mayor's Office,Deputy Mayor for Health and Human Services,New York City Charter,"Chapter 66, Section 2400",https://codelibrary.amlegal.com/codes/newyorkcity/latest/NYCcharter/0-0-0-3953,"There shall be a department for the aging, the head of which shall be the commissioner for the aging.",,,NYC AGING,DFTA,125.0,Lorraine A. Cortés-Vázquez,Commissioner,https://data.cityofnewyork.us/browse?Dataset-Information_Agency=Department+for+the+Aging+%28NYC Aging%29,,1973.0,,department-for-the-aging,2024-07-29,,,"Aging, Department for the (NYC Aging)","Aging, Department for the (NYC Aging)",Department for the Aging (NYC Aging),Department for the Aging (DFTA),Department for the Aging,Department for the Aging,"Aging, Department for the",Department for the Aging,Department for the Aging (NYC AGING),"Aging, Department for the (NYC AGING)",Lorraine,Cortés-Vázquez,department for the aging,REC_000043,,,,,REC_000078,,nyc_agencies_export
Deputy Chief Administrative Judge for the New York City Courts,Deputy Chief Administrative Judge for the New York City Courts,Active,Judiciary,,,,,New York State,,,,,,,,,,,,,2021.0,,deputy-chief-administrative-judge-for-the-new-york-city-courts,2024-07-29,,,,,,,,,Deputy Chief Administrative Judge for the New York City Courts,,Deputy Chief Administrative Judge for the New York City Courts,Deputy Chief Administrative Judge for the New York City Courts,,,deputy chief administrative judge for the courts,REC_000068,,,,,REC_000079,,nyc_agencies_export
Deputy Mayor for Communications,"Communications, Deputy Mayor for",Active,Mayoral Office,,,Mayor's Office,Mayor's Office,Mayoral Executive Order,"Executive Order 5, 2022",https://a860-gpp.nyc.gov/concern/nyc_government_publications/gm80hx70d?locale=en,"Establishes the titles, duties, and responsibilities of the six Deputy Mayors, the Chief of Staff to the Mayor, and the Chief Counsel to the mayor and City Hall. Revokes Executive Order No. 56, dated March 21, 2021.",,,,,,,,,,,,deputy-mayor-for-communications,2024-07-29,,,,,,,,,,,Deputy Mayor for Communications,"Communications, Deputy Mayor for",,,deputy mayor for communications,REC_000215,,,,,REC_000080,,nyc_agencies_export
Deputy Mayor for Health and Human Services,"Health and Human Services, Deputy Mayor for",Active,Mayoral Office,,,Mayor's Office,First Deputy Mayor,Mayoral Executive Order,"Executive Order 29, 2023",https://a860-gpp.nyc.gov/concern/nyc_government_publications/pc289n032?locale=en,"there shall be six Deputy Mayors, a Chief Housing Officer, Chief Technology Officer, Chief Efficiency Officer, Chief of Staff, Chief Advisor, Chief Counsel to the Mayor, Dir. of Intergovernmental; etc.",,,DMHHS,,,,Deputy Mayor for Health and Human Services,,,2022.0,,deputy-mayor-for-health-and-human-services,2024-07-29,,,,Office of the Deputy Mayor for Health and Human Services,,Deputy Mayor for Health and Human Services (DMHHS),Deputy Mayor for Health and Human Services,,,,Deputy Mayor for Health and Human Services (DMHHS),"Health and Human Services, Deputy Mayor for (DMHHS)",,,deputy mayor for health and human services,REC_000070,,,,,REC_000081,,nyc_agencies_export
,,,,,,,,,,,,,,,,,,,,,,,,,,,,,,,,,,,,,,,design department construction,,,,,,REC_000092,Department of Design and Construction,ops
,,,,,,,,,,,,,,,,,,,,,,,,,,,,,,,,,,,,,,,disconnected youth task force,,,,,,REC_000217,Disconnected Youth Task Force,ops
,,,,,,,,,,,,,,,,,,,,,,,,,,,,,,,,,,,,,,,district attorney bronx county,,REC_000050,District Attorney,https://www.bronxda.nyc.gov/html/home/home.shtml,District Attorney- Bronx County,REC_000397,District Attorney Bronx County,ops
,,,,,,,,,,,,,,,,,,,,,,,,,,,,,,,,,,,,,,,district attorney kings county,,REC_000051,District Attorney,http://www.brooklynda.org/,District Attorney- Kings County (Brooklyn),REC_000396,District Attorney Kings County (Brooklyn),ops
,,,,,,,,,,,,,,,,,,,,,,,,,,,,,,,,,,,,,,,district attorney new york county,,REC_000052,District Attorney,https://manhattanda.org/,District Attorney- New York County (Manhattan),REC_000398,District Attorney New York County (Manhattan),ops
,,,,,,,,,,,,,,,,,,,,,,,,,,,,,,,,,,,,,,,district attorney queens county,,REC_000053,District Attorney,https://queensda.org/,District Attorney- Queens County,REC_000399,District Attorney Queens County,ops
,,,,,,,,,,,,,,,,,,,,,,,,,,,,,,,,,,,,,,,district attorney richmond county,,REC_000054,District Attorney,https://www.statenislandda.org/,District Attorney- Richmond County (Staten Island),REC_000400,District Attorney Richmond County (Staten Island),ops
Districting Commission,Districting Commission,Active,"Advisory, Oversight, or Regulatory Body",,https://www.nyc.gov/site/districting/index.page,,Independent,New York City Charter,"Chapter 2-A, Section 50",https://codelibrary.amlegal.com/codes/newyorkcity/latest/NYCcharter/0-0-0-434,There shall be a districting commission consisting of fifteen members appointed as provided in this section.,,,,,,,,,,,,districting-commission,2024-07-29,,,,,,,,,,Districting Commission,Districting Commission,Districting Commission,,,districting commission,REC_000075,,,,,REC_000212,New York City Districting Commission,ops
,,,,,,,,,,,,,,,,,,,,,,,,,,,,,,,,,,,,,,,domestic violence fatality review committee,,,,,,REC_000216,Domestic Violence Fatality Review Committee,ops
,,,,,,,,,,,,,,,,,,,,,,,,,,,,,,,,,,,,,,,drug strategy advisory council,,,,,,REC_000215,Drug Strategy Advisory Council,ops
Economic Development Corporation,Economic Development Corporation,Active,Authority or Public Benefit Corporation,"The New York City Economic Development Corporation (NYCEDC), a nonprofit organization operating under contract with the City of New York, is the City’s primary vehicle for economic development services. NYCEDC serves as a catalyst for public and private initiatives that promote the City’s long-term vitality. Through affordable financing, tax exemptions and low-cost energy programs, NYCEDC helps City businesses gain the competitive edge they need to meet their short- and long-term goals.",http://www.nycedc.com,,"Deputy Mayor for Housing, Economic Development and Workforce",New York State Law,,,,,,NYCEDC,,,Andrew Kimball,President and CEO,https://data.cityofnewyork.us/browse?Dataset-Information_Agency=Economic+Development+Corporation+%28EDC%29,,1991.0,,economic-development-corporation,2024-07-29,,,Economic Development Corporation (NYCEDC),Economic Development Corporation (NYCEDC),Economic Development Corporation (EDC),Economic Development Corporation (EDC),,Economic Development Corporation,"Economic Development Corporation, NYC",,Economic Development Corporation (NYCEDC),Economic Development Corporation (NYCEDC),Andrew,Kimball,economic development corporation,REC_000077,REC_000055,President and CEO,https://edc.nyc/,Economic Development Corporation (NYCEDC),REC_000111,Economic Development Corporation,ops
,,,,,,,,,,,,,,,,,,,,,,,,,,,,,,,,,,,,,,,economic development corporation board trustees,,,,,,REC_000220,Economic Development Corporation Board of Trustees,ops
,,,,,,,,,,,,,,,,,,,,,,,,,,,,,,,,,,,,,,,economic development corporation life sciences advisory council,,,,,,REC_000221,Economic Development Corporation Life Sciences Advisory Council,ops
,,,,,,,,,,,,,,,,,,,,,,,,,,,,,,,,,,,,,,,economic development corporation real estate life sciences advisory board,,,,,,REC_000222,Economic Development Corporation Real Estate Life Sciences Advisory Board,ops
