Name,Agency Code,Parent Organization,Child Organization(s),Acronym,Agency Type,Website
Administration for Children's Services (ACS),068,,,ACS,City Department,https://www.nyc.gov/site/acs/index.page
Association for a Better New York (ABNY),,,,ABNY,Other,abny.org
Board of Correction (BOC),073,,,BOC,Other,https://www.nyc.gov/site/boc/index.page
Board of Education Retirement System (BERS),,,,BERS,Other,https://www.bers.nyc.gov/
Board of Elections (BOE),003,,,BOE,Other,vote.nyc
Board of Standards and Appeals (BSA),,,,BSA,City Department,https://www.nyc.gov/site/bsa/index.page
Broadway Theater,,,,Broadway Theater,Other,broadway.com
Bronx Borough President (BXBP),011,,,BXBP,Other,https://bronxboropres.nyc.gov/
Bronx County District Attorney (BXDA),902,,,BXDA,Other,https://www.bronxda.nyc.gov/html/home/home.shtml
Brooklyn Borough President (BKBP),012,,,BKBP,Other,https://www.brooklynbp.nyc.gov/
Brooklyn Navy Yard Development Corporation (BNYDC),,,,BNYDC,Other,https://brooklynnavyyard.org/
Brooklyn Public Library (BPL),038,,,BPL,Other,https://www.bklynlibrary.org/
Business Integrity Commission (BIC),829,,,BIC,Other,https://www.nyc.gov/site/bic/index.page
Campaign Finance Board (CFB),004,,,CFB,Other,https://nyccfb.info/about
Center for Innovation through Data Intelligence (CIDI) ,,,,CIDI,Other,https://www.nyc.gov/site/cidi/index.page
Charter Revision Commission (CRC),,,,CRC,Other,https://www.nyc.gov/site/charter/index.page
Children's Cabinet,,,,Children's Cabinet,Mayor's Office,https://www.nyc.gov/site/childrenscabinet/index.page
City Commission on Human Rights (CCHR),226,,,CCHR,City Department,https://www.nyc.gov/site/cchr/index.page
City Council (NYCC),102,,,NYCC,City Department,https://council.nyc.gov/
City University of New York (CUNY),042,,,CUNY,Other,cuny.edu
Civic Engagement Commission (CEC),,Mayor's Office of Engagement,,CEC,Other,https://www.nyc.gov/site/civicengagement/index.page
Civil Service Commission (CSC),134,,,CSC,Other,https://www.nyc.gov/site/csc/index.page
Civilian Complaint Review Board (CCRB),054,,,CCRB,Other,https://www.nyc.gov/site/ccrb/index.page
Commission on Gender Equity (CGE),,Mayor's Office of Equity (MOE),,CGE,Other,https://www.nyc.gov/site/genderequity/index.page
Commission to Combat Police Corruption (CCPC),,,,CCPC,Other,https://www.nyc.gov/site/ccpc/index.page
Conflicts of Interest Board (COIB),312,,,COIB,Other,https://www.nyc.gov/site/coib/index.page
Department for the Aging (DFTA),125,,,DFTA,City Department,https://www.nyc.gov/site/dfta/index.page
Department of Buildings (DOB),810,,,DOB,City Department,https://www.nyc.gov/site/buildings/index.page
Department of City Planning (DCP),030,,,DCP,City Department,https://www.nyc.gov/site/planning/index.page
Department of Citywide Administrative Services (DCAS),856,,,DCAS,City Department,https://www.nyc.gov/site/dcas/index.page
Department of Consumer and Worker Protection (DCWP),866,,,DCWP,City Department,https://www.nyc.gov/site/dca/index.page
Department of Correction (DOC),072,,,DOC,City Department,https://www.nyc.gov/site/doc/index.page
Department of Cultural Affairs (DCLA),126,,,DCLA,City Department,https://www.nyc.gov/site/dcla/index.page
Department of Design and Construction (DDC),850,,,DDC,City Department,https://www.nyc.gov/site/ddc/about/about-ddc.page
Department of Education (DOE),040,,,DOE,City Department,https://www.schools.nyc.gov/
Department of Environmental Protection (DEP),826,,,DEP,City Department,https://www.nyc.gov/site/dep/index.page
Department of Finance (DOF),836,,"NYC Sheriff (SHERIFF),Mayor's Office of Pensions & Investments",DOF,City Department,https://www.nyc.gov/site/finance/index.page
Department of Health and Mental Hygiene (DOHMH),816,,,DOHMH,City Department,https://www.nyc.gov/site/doh/about/about-doh.page
Department of Homeless Services (DHS),071,Department of Social Services (DSS),,DHS,City Department,https://www.nyc.gov/site/dhs/index.page
Department of Housing Preservation and Development (HPD),806,,,HPD,City Department,https://www.nyc.gov/site/hpd/index.page
Department of Investigation (DOI),032,,,DOI,City Department,https://www.nyc.gov/site/doi/index.page
Department of Parks and Recreation (PARKS),846,,,PARKS,City Department,https://www.nycgovparks.org/
Department of Probation (DOP),781,,,DOP,City Department,https://www.nyc.gov/site/probation/index.page
Department of Records and Information Services (DORIS),860,,,DORIS,City Department,https://www.nyc.gov/site/records/index.page
Department of Sanitation (DSNY),827,,,DSNY,City Department,https://www.nyc.gov/assets/dsny/site/home
Department of Small Business Services (SBS),801,,,SBS,City Department,https://www.nyc.gov/site/sbs/index.page
Department of Social Services (DSS),069,,"Human Resources Administration (HRA),Department of Homeless Services (DHS)",DSS,City Department,https://www.nyc.gov/site/dss/index.page
Department of Transportation (DOT),841,,,DOT,City Department,https://www.nyc.gov/html/dot/html/home/home.shtml
Department of Veterans' Services (DVS),063,,,DVS,City Department,https://www.nyc.gov/site/veterans/index.page
Department of Youth and Community Development (DYCD),260,,,DYCD,City Department,https://www.nyc.gov/site/dycd/index.page
Deputy Mayor for Economic and Workforce Development (DMEWD),,,,DMEWD,Mayor's Office,
Deputy Mayor for Health and Human Services (DMHHS),,,,DMHHS,Mayor's Office,
Deputy Mayor for Operations (DMOPS),,,,DMOPS,Mayor's Office,
Deputy Mayor for Public Safety (DMPS),,,,DMPS,Mayor's Office,
Deputy Mayor for Strategic Initiatives (DMSI),,,,DMSI,Mayor's Office,
Downtown Brooklyn Partnership (DBP),,,,DBP,Other,downtownbrooklyn.com
Economic Development Corporation (EDC),,,,EDC,Other,https://edc.nyc/
Environmental Control Board (ECB),,Office of Administrative Trials and Hearings (OATH),,ECB,Other,https://www.nyc.gov/site/oath/hearings/about-ecb.page
Equal Employment Practices Commission (EEPC),133,,,EEPC,Other,https://www.nyc.gov/site/eepc/index.page
Financial Information Services Agency / Office of Payroll Administration (FISA-OPA),127/131,,,FISA-OPA,City Department,https://www.nyc.gov/site/opa/index.page
Fire Department Pension Fund & Related Funds (NYCFPF),,,,NYCFPF,Other,https://nycfirepension.org/
Grand Central Partnership,,,,Grand Central Partnership,Other,grandcentralpartnership.nyc
Housing Development Corporation (HDC),,,,HDC,Other,https://www.nychdc.com/
Human Resources Administration (HRA),,Department of Social Services (DSS),,HRA,Other,https://www.nyc.gov/site/hra/index.page
Independent Budget Office (IBO),132,,,IBO,Other,https://ibo.nyc.ny.us/
Kings County District Attorney (BKDA),903,,,BKDA,Other,http://www.brooklynda.org/
Kings County Public Administrator (KCPA),943,,,KCPA,City Department,https://www.nyc.gov/site/kcpa/index.page
Landmarks Preservation Commission (LPC),136,,,LPC,Other,https://www.nyc.gov/site/lpc/index.page
Law Department (Law),025,,,Law,City Department,https://www.nyc.gov/site/law/index.page
Made in New York (MINY),,,,MINY,Other,https://www.madeinnyc.org/
Manhattan Borough President (MBPO),010,,,MBPO,Other,https://www.manhattanbp.nyc.gov/
Mayor's Advisory Committee on the Judiciary (MACJ),002,,,MACJ,Mayor's Office,https://www.nyc.gov/site/macj/index.page
Mayor's Community Affairs Unit (CAU),002,Mayor's Office of Engagement,"Office of Animal Welfare,Mayor's Office of Faith-Based and Community Partnerships (CFP)",CAU,Mayor's Office,https://www.nyc.gov/site/cau/index.page
Mayor's Office for Child Care and Early Childhood Education,002,,,Mayor's Office for Child Care and Early Childhood Education,Mayor's Office,
Mayor's Office for Economic Opportunity (NYC Opportunity),002,,,NYC Opportunity,Mayor's Office,https://www.nyc.gov/site/opportunity/index.page
Mayor's Office for International Affairs,002,,,Mayor's Office for International Affairs,Mayor's Office,https://www.nyc.gov/site/international/index.page
Mayor's Office for People with Disabilities (MOPD),002,,,MOPD,Mayor's Office,https://www.nyc.gov/site/mopd/index.page
Mayor's Office of Appointments (MOA),002,,,MOA,Mayor's Office,https://www.nyc.gov/site/appointments/index.page
Mayor's Office of Asylum Seeker Operations,002,,,Mayor's Office of Asylum Seeker Operations,Mayor's Office,
Mayor's Office of City Legislative Affairs,002,Mayor's Office of Intergovernmental Affairs (MOIGA),,Mayor's Office of City Legislative Affairs,Mayor's Office,https://www.nyc.gov/site/intergovernmental/city/city-legislative-affairs.page
Mayor's Office of Citywide Event Coordination and Management (CECM),002,,,CECM,Mayor's Office,https://www.nyc.gov/site/cecm/index.page
Mayor's Office of Climate and Environmental Justice (MOCEJ),002,,"Office of Environmental Coordination (MOEC),Office of Climate Resiliency (MOCR),Office of Environmental Remediation (OER)",MOCEJ,Mayor's Office,https://climate.cityofnewyork.us/about/
Mayor's Office of Communications (COMMS),002,,,COMMS,Mayor's Office,
Mayor's Office of Community Mental Health (OCMH),002,,,OCMH,Mayor's Office,https://mentalhealth.cityofnewyork.us/
Mayor's Office of Contract Services (MOCS),002,,,MOCS,Mayor's Office,https://www.nyc.gov/site/mocs/index.page
Mayor's Office of Criminal Justice (MOCJ),002,,"Office to Prevent Gun Violence,Office for the Prevention of Hate Crimes,Office of Special Enforcement (OSE)",MOCJ,Mayor's Office,https://criminaljustice.cityofnewyork.us/
Mayor's Office of Efficiency,002,,,Mayor's Office of Efficiency,Mayor's Office,
Mayor's Office of Engagement,002,,"NYC Service,Civic Engagement Commission (CEC),Public Engagement Unit (PEU),Mayor's Community Affairs Unit (CAU)",Mayor's Office of Engagement,Mayor's Office,
Mayor's Office of Equity (MOE),002,,"Young Men's Initiative (YMI),Commission on Gender Equity (CGE),Racial Justice Commission (RJC),Taskforce on Racial Inclusion & Equity (TRIE),Pay Equity Cabinet (PEC),Unity Project (UP)",MOE,Mayor's Office,https://www.nyc.gov/site/equity/about/about.page
Mayor's Office of Ethnic and Community Media (MOECM),002,Mayor's Office of Media and Entertainment (MOME),,MOECM,Mayor's Office,https://www.nyc.gov/site/mome/industries/community-media.page
Mayor's Office of Faith-Based and Community Partnerships (CFP),002,Mayor's Community Affairs Unit (CAU),,CFP,Mayor's Office,https://www.nyc.gov/site/cfcp/index.page
Mayor's Office of Federal Legislative Affairs (Fed Leg),002,Mayor's Office of Intergovernmental Affairs (MOIGA),,Fed Leg,Mayor's Office,https://www.nyc.gov/site/intergovernmental/federal/federal-legislative-affairs.page
Mayor's Office of Food Policy (MOFP),002,,,MOFP,Mayor's Office,https://www.nyc.gov/site/foodpolicy/index.page
Mayor's Office of Housing Recovery Operations (HRO),002,,,HRO,Mayor's Office,https://www.nyc.gov/site/housingrecovery/index.page
Mayor's Office of Immigrant Affairs (MOIA),002,,,MOIA,Mayor's Office,https://www.nyc.gov/site/immigrants/index.page
Mayor's Office of Intergovernmental Affairs (MOIGA),002,,"Mayor's Office of City Legislative Affairs,Mayor's Office of Federal Legislative Affairs (Fed Leg),Mayor's Office of State Legislative Affairs",MOIGA,Mayor's Office,https://www.nyc.gov/site/intergovernmental/index.page
Mayor's Office of Management and Budget (OMB),002,,,OMB,Mayor's Office,https://www.nyc.gov/site/omb/index.page
Mayor's Office of Media and Entertainment (MOME),002,,"NYC Media,""Office of Film, Theater & Broadcasting"",Office of Nightlife,Mayor's Office of Ethnic and Community Media (MOECM)",MOME,Mayor's Office,https://www.nyc.gov/site/mome/index.page
Mayor's Office of Minority and Women Owned Businesses (MWBE),002,,,MWBE,Mayor's Office,https://nyc-business.nyc.gov/nycbusiness/mwbe
Mayor's Office of Nonprofits (NYC NONPROFITS),002,,,NYC NONPROFITS,Mayor's Office,https://www.nyc.gov/site/nonprofits/index.page
Mayor's Office of Operations (OPS),002,,,OPS,Mayor's Office,https://www.nyc.gov/site/operations/index.page
Mayor's Office of Pensions & Investments,002,Department of Finance (DOF),,Mayor's Office of Pensions & Investments,Mayor's Office,https://www.nyc.gov/site/finance/about/divisions.page#:~:text=Mayor%E2%80%99s%20Office%20of%20Pensions%20and%20Investments
Mayor's Office of Policy and Planning,002,,,Mayor's Office of Policy and Planning,Mayor's Office,
Mayor's Office of Risk Management and Compliance (RMC),002,,,RMC,Mayor's Office,
Mayor's Office of Special Projects and Community Events (MOSPCE),002,,,MOSPCE,Mayor's Office,https://www.nyc.gov/site/mospce/index.page
"Mayor's Office of Sports, Wellness, and Recreation (MOSWR)",002,,,MOSWR,Mayor's Office,https://www.nyc.gov/content/sports/pages/
Mayor's Office of State Legislative Affairs,002,Mayor's Office of Intergovernmental Affairs (MOIGA),,Mayor's Office of State Legislative Affairs,Mayor's Office,https://www.nyc.gov/site/intergovernmental/state/state-legislative-affairs.page
Mayor's Office of Urban Agriculture,002,,,Mayor's Office of Urban Agriculture,Mayor's Office,https://www.nyc.gov/site/agriculture/index.page
Mayor's Office of Youth Employment (MOYE),002,,,MOYE,Mayor's Office,https://www.nyc.gov/site/youthemployment/index.page
Mayor's Office to End Domestic and Gender-Based Violence (ENDGBV),002,,,ENDGBV,Mayor's Office,https://www.nyc.gov/site/ocdv/index.page
Mayor's Office to Protect Tenants (MOPT),002,,,MOPT,Mayor's Office,https://www.nyc.gov/content/tenantprotection/pages/
Mayor’s Office of Innovation and Emerging Markets,002,,,Mayor’s Office of Innovation and Emerging Markets,Mayor's Office,
Mayor’s Office of Talent and Workforce Development (WKDEV),002,,,WKDEV,Mayor's Office,https://www.nyc.gov/site/wkdev/index.page
Mayors' Office of the Chief Counsel to the Mayor and City Hall,002,,,Mayors' Office of the Chief Counsel to the Mayor and City Hall,Mayor's Office,https://www.nyc.gov/site/counseltothemayor/index.page
Metropolitan Transportation Authority (MTA),998,,,MTA,Other,https://new.mta.info/
New York City Fire Department (FDNY),057,,,FDNY,City Department,https://www.nyc.gov/site/fdny/index.page
New York City Housing Authority (NYCHA),,,,NYCHA,Other,https://www.nyc.gov/site/nycha/index.page
New York City Police Department (NYPD),056,,,NYPD,City Department,https://www.nyc.gov/site/nypd/index.page
New York City Tax Commission (TAXCOMM),,,,TAXCOMM,Other,https://www.nyc.gov/site/taxcommission/index.page
New York City Water Board (NYWB),,,,NYWB,Other,https://www.nyc.gov/site/nycwaterboard/index.page
New York City Water Supply System (Water Supply),085,Department of Environmental Protection (DEP),,Water Supply,City Department,https://www.nyc.gov/site/dep/water/water-supply.page
New York County District Attorney (NYDA),901,,,NYDA,Other,https://manhattanda.org/
New York County Public Administrator (NYCPA),941,,,NYCPA,City Department,https://www.nyc.gov/site/nycountypa/index.page
New York Public Library (NYPL),037,,,NYPL,Other,https://www.nypl.org/
New York State Energy Research and Development Authority (NYSERDA),,,,NYSERDA,Other,nyserda.ny.gov
NYC & Company (NYCGO),,,,NYCGO,Other,nycgo.com
NYC Care,,NYC Health + Hospitals (H+H),,NYC Care,Other,https://www.nyccare.nyc/
NYC Cyber Command (NYC3),,Office of Technology and Innovation (OTI),,NYC3,Other,https://www.nyc.gov/content/oti/pages/meet-the-team/cyber-command
NYC Emergency Management (NYCEM),017,,,NYCEM,City Department,https://www.nyc.gov/site/em/index.page
NYC Employees' Retirement System (NYCERS),,,,NYCERS,Other,https://www.nycers.org/
NYC Health + Hospitals (H+H),819,,NYC Care,H+H,Other,https://www.nychealthandhospitals.org/
NYC Media,,Mayor's Office of Media and Entertainment (MOME),,NYC Media,Other,https://www.nyc.gov/site/media/index.page
NYC Office of Asylum Seeker Operations (OASO),,,,OASO,Mayor's Office,
NYC Service,,Mayor's Office of Engagement,,NYC Service,Mayor's Office,https://www.nycservice.org/
NYC Sheriff (SHERIFF),,Department of Finance (DOF),,SHERIFF,Other,https://www.nyc.gov/site/finance/sheriff-courts/sheriff.page
Office for the Prevention of Hate Crimes,,Mayor's Office of Criminal Justice (MOCJ),,Office for the Prevention of Hate Crimes,Mayor's Office,https://www.nyc.gov/site/stophate/index.page
Office of Administrative Tax Appeals (OATA),021,,,OATA,Mayor's Office,https://www.nyc.gov/site/oata/index.page
Office of Administrative Trials and Hearings (OATH),820,,Environmental Control Board (ECB),OATH,Other,https://www.nyc.gov/site/oath/index.page
Office of Animal Welfare,,Mayor's Community Affairs Unit (CAU),,Office of Animal Welfare,Mayor's Office,https://www.nyc.gov/site/animalwelfare/index.page
Office of Chief Medical Examiner (OCME),,,,OCME,Other,https://www.nyc.gov/site/ocme/index.page
Office of Climate Resiliency (MOCR),,Mayor's Office of Climate and Environmental Justice (MOCEJ),,MOCR,Mayor's Office,https://www1.nyc.gov/site/orr/index.page
Office of Collective Bargaining (OCB),313,,,OCB,Mayor's Office,https://www.ocb-nyc.org/
Office of Data Analytics (ODA),,Office of Technology and Innovation (OTI),,ODA,Other,https://www.nyc.gov/content/oti/pages/data-analytics
Office of Environmental Coordination (MOEC),,Mayor's Office of Climate and Environmental Justice (MOCEJ),,MOEC,Mayor's Office,https://www.nyc.gov/site/oec/index.page
Office of Environmental Remediation (OER),,Mayor's Office of Climate and Environmental Justice (MOCEJ),,OER,Mayor's Office,https://www.nyc.gov/site/oer/index.page
"Office of Film, Theater & Broadcasting",,Mayor's Office of Media and Entertainment (MOME),,"Office of Film, Theater & Broadcasting",Mayor's Office,
Office of Information Privacy (OIP),,Office of Technology and Innovation (OTI),,OIP,Other,https://www.nyc.gov/content/oti/pages/information-privacy
Office of Labor Relations (OLR),,,,OLR,Mayor's Office,https://www.nyc.gov/site/olr/index.page
Office of Nightlife,,Mayor's Office of Media and Entertainment (MOME),,Office of Nightlife,Mayor's Office,https://www.nyc.gov/site/mome/nightlife/nightlife.page
Office of Special Enforcement (OSE),,Mayor's Office of Criminal Justice (MOCJ),,OSE,Mayor's Office,https://www.nyc.gov/site/specialenforcement/index.page
Office of Technology and Innovation (OTI),858,,"311,NYC Cyber Command (NYC3),Office of Data Analytics (ODA),Office of Information Privacy (OIP)",OTI,City Department,https://www.nyc.gov/content/oti/pages/
Office of the Actuary,008,,,Office of the Actuary,Other,https://www.nyc.gov/site/actuary/index.page
Office of the Administrative Justice Coordinator (AJC),,Mayor's Office of Criminal Justice (MOCJ),,AJC,Mayor's Office,https://www.nyc.gov/site/ajc/index.page
Office of the City Clerk (OCC),103,,,OCC,Other,https://www.cityclerk.nyc.gov/content/
Office of the Comptroller (COMPTROLLER),015,,Brooklyn Navy Yard Development Corporation (BNYDC),COMPTROLLER,Other,https://comptroller.nyc.gov/
Office of the Mayor of New York City,,,,Office of the Mayor of New York City,Mayor's Office,https://www.nyc.gov/office-of-the-mayor/index.page
Office of the Public Advocate,101,,,Office of the Public Advocate,Other,https://pubadvocate.nyc.gov/
Office of the Special Narcotics Prosecutor (SNP),906,,,SNP,Other,https://www.snpnyc.org/
Office to Prevent Gun Violence,,Mayor's Office of Criminal Justice (MOCJ),,Office to Prevent Gun Violence,Mayor's Office,https://www.nyc.gov/site/peacenyc/index.page
Pay Equity Cabinet (PEC),,Mayor's Office of Equity (MOE),,PEC,Other,
Police Pension Fund (NYCPPF),,,,NYCPPF,Other,https://www.nyc.gov/html/nycppf/html/home/home.shtml
Public Design Commission (PDC),,,,PDC,Other,https://www.nyc.gov/site/designcommission/index.page
Public Engagement Unit (PEU),,Mayor's Office of Engagement,,PEU,Other,https://www.nyc.gov/site/mayorspeu/index.page
Queens Borough President (QBP),013,,,QBP,Other,https://queensbp.org/
Queens County District Attorney (QDA),904,,,QDA,Other,https://queensda.org/
Queens County Public Administrator (QCPA),944,,,QCPA,City Department,https://www.queenscountypa.com/
Queens Library (QPL),039,,,QPL,Other,https://www.queenslibrary.org/
Racial Justice Commission (RJC),,Mayor's Office of Equity (MOE),,RJC,Other,https://racialjustice.cityofnewyork.us/
Rent Guidelines Board (RGB),,,,RGB,Other,https://rentguidelinesboard.cityofnewyork.us/
Richmond County District Attorney (RCDA),905,,,RCDA,Other,https://www.statenislandda.org/
Richmond County Public Administrator (RCPA),945,,,RCPA,City Department,https://www.nyc.gov/site/rcpa/index.page
School Construction Authority (SCA),044,,,SCA,Other,http://www.nycsca.org/
Staten Island Borough President (SIBP),014,,,SIBP,Other,https://www.statenislandusa.com/
Taskforce on Racial Inclusion & Equity (TRIE),,Mayor's Office of Equity (MOE),,TRIE,Other,https://www.nyc.gov/site/trie/index.page
Tax Appeals Tribunal (NYC TAT),,Office of Administrative Tax Appeals (OATA),,NYC TAT,Other,https://www.nyc.gov/site/taxappeals/index.page
Taxi and Limousine Commission (TLC),156,,,TLC,City Department,https://www.nyc.gov/site/tlc/index.page
Teacher's Retirement System of the City of New York (TRS),,,,TRS,Other,https://www.trsnyc.org/
The Special Commissioner of Investigation for the New York City School District (NYCSCI),,,,NYCSCI,Other,https://nycsci.org/
The Village Alliance,,,,The Village Alliance,Other,greenwichvillage.nyc
Times Square Alliance (TSA),,,,TSA,Other,timessquarenyc.org
Union Square Partnership,,,,Union Square Partnership,Other,unionsquarenyc.org
Unity Project (UP),,Mayor's Office of Equity (MOE),,UP,Other,https://growingupnyc.cityofnewyork.us/generationnyc/topics/lgbtq/
Young Men's Initiative (YMI),,Mayor's Office of Equity (MOE),,YMI,Other,https://www.nyc.gov/site/ymi/index.page
